{
  "id": "streamsnap",
  "name": "StreamSnap",
  "version": "0.1.3",
  "description": "Match river monitoring sites to the correct stream segment interactively and snap sites onto the network.",
  "author": "wangzcl@WEN-Research-Group",
  "homepage": "https://github.com/WEN-Research-Group/StreamSnap",
  "manifestUrl": "plugins/streamsnap/plugin.json",
  "source": {
    "url": "https://github.com/WEN-Research-Group/StreamSnap/releases/download/v0.1.3/streamsnap-0.1.3.zip",
    "sha256": "1ca7a6d9aa7b7260d1d3d6d0849d6631f022d56a0440dec8271883b778124df3"
  },
  "categories": ["Hydrology"],
  "minGeoLibreVersion": "2.9.0"
}
