{
  "id": "zarr-timeseries-viewer",
  "name": "Zarr Time Series Viewer",
  "version": "0.7.5",
  "description": "Discover variables in local folders or remote Zarr time-series cubes, then explore them with playback, custom color palettes, and click-to-chart pixel histories.",
  "author": "Joao Pereira",
  "homepage": "https://github.com/opengeos/geolibre-plugins",
  "manifestUrl": "plugins/zarr-timeseries-viewer/plugin.json",
  "source": {
    "url": "https://github.com/JPPereira93/geolibre-plugins/releases/download/zarr-timeseries-viewer-v0.7.5/zarr-timeseries-viewer-0.7.5.zip",
    "sha256": "521d25cc072594dea30a459db184383990613369b0c2ffa7e3cc2493c84ca5a5"
  },
  "categories": ["Raster", "Visualization", "Data"],
  "minGeoLibreVersion": "3.3.0",
  "screenshots": [
    {
      "path": "screenshots/generic-zarr-viewer.png",
      "caption": "Generic non-NDVI Zarr time series with variable metadata and pixel history"
    }
  ]
}
