{
  "id": "poster-studio",
  "name": "Poster Studio · 地图海报",
  "version": "0.5.0",
  "description": "Create city map posters with live map selection, editable print scale, custom colors and place markers. Export vector SVG or 300 dpi PNG, and import offline city data packages. Chinese interface.",
  "author": "CUGbaoyi",
  "homepage": "https://github.com/CUGbaoyi/geolibre-poster-studio",
  "repository": "https://github.com/CUGbaoyi/geolibre-poster-studio",
  "issues": "https://github.com/CUGbaoyi/geolibre-poster-studio/issues",
  "license": "MIT",
  "manifestUrl": "plugins/poster-studio/plugin.json",
  "source": {
    "url": "https://github.com/CUGbaoyi/geolibre-poster-studio/releases/download/v0.5.0/poster-studio-0.5.0.zip",
    "sha256": "b1b4af3bd8e3753b2c945f38b5ebc20c4dd5ed84ef45503490d1e725b928be96"
  },
  "screenshots": [
    {
      "path": "screenshots/overview.jpg",
      "caption": "Nanjing neighborhood print with map selection, print scale and live poster preview"
    }
  ],
  "categories": ["Cartography", "Visualization"],
  "minGeoLibreVersion": "3.3.0"
}
