{
  "id": "kml-kmz-import",
  "name": "KML / KMZ Import",
  "version": "0.3.1",
  "description": "Import styled KML and KMZ files as organized GeoLibre vector and globe-compatible raster layers, with local parsing, feature information, altitude-aware 3D points, and GroundOverlay conversion.",
  "author": "Husayn El Sharif",
  "homepage": "https://github.com/helsharif/geolibre-kml-kmz-import",
  "manifestUrl": "plugins/kml-kmz-import/plugin.json",
  "categories": ["Data", "Vector"],
  "minGeoLibreVersion": "2.2.0",
  "source": {
    "url": "https://github.com/helsharif/geolibre-kml-kmz-import/releases/download/v0.3.1/kml-kmz-import-0.3.1.zip",
    "sha256": "d97a0bd5f91e8d1c543a2e5397389447d25e49425f452f2e062a997212a48403"
  }
}
