{
  "id": "openrndt-geolibre",
  "name": "RNDT catalogue",
  "version": "0.3.15",
  "description": "Search the Italian national catalogue of spatial data (RNDT) and add its WMS/WFS services to the map.",
  "author": "onData",
  "homepage": "https://github.com/ondata/openrndt-geolibre",
  "repository": "https://github.com/ondata/openrndt-geolibre",
  "issues": "https://github.com/ondata/openrndt-geolibre/issues",
  "license": "MIT",
  "manifestUrl": "plugins/openrndt-geolibre/plugin.json",
  "source": {
    "url": "https://github.com/ondata/openrndt-geolibre/releases/download/v0.3.15/openrndt-geolibre-0.3.15.zip",
    "sha256": "3630e66e2f48a6034bbf0b3ea253cbf389a9ccd2cc64923c3e98dcb216a8a624"
  },
  "categories": ["Data"],
  "publishableSettings": true,
  "minGeoLibreVersion": "3.4.0",
  "screenshots": [
    {
      "path": "screenshots/search.webp",
      "caption": "A search of the national catalogue: the records listed in the panel, their footprints on the map."
    },
    {
      "path": "screenshots/record.webp",
      "caption": "A record's detail view: its abstract and the layers of its WFS and WMS services, with readable names."
    },
    {
      "path": "screenshots/layers.webp",
      "caption": "WMS layers of a record added to the map."
    },
    {
      "path": "screenshots/identify.webp",
      "caption": "A feature of an added WMS layer queried with GeoLibre's Identify."
    }
  ]
}
